{
  "$schema": "https://wcarmon.com/schemas/codegen/field.schema.json",
  "golang": {
    "defaultValue": {
      "value": null
    }
  },
  "jvm": {
    "defaultValue": {
      "value": null
    }
  },
  "name": "deadline",
  "nullable": true,
  "rdbms": {
    "defaultValue": {
      "value": null
    }
  },
  "type": "Instant"
}
